Дом,Район,Пол,Статус,Wi-Fi,Кухня,Стиралка,Доп.удобства,Описание,Преимущества,Цена от,Цена до
1,Горный Гигант,только парни,активен,да,да,да,"камеры, огнетушители, пожарная сигнализация","Дом в тихой части района Горный Гигант — свежий воздух, спокойная атмосфера, удобно для учёбы.",,65000,70000
2,Парк Горького,"смешанный (парни и девушки, отдельные комнаты)",активен,да,да,да,,"Рядом с парком Горького, удобный район. Недалеко Арбат и две конечные остановки общественного транспорта — можно без пересадок добраться до многих вузов Алматы. Развитая инфраструктура.",📍 Рядом с парком Горького; 🚍 Две конечные остановки транспорта; 🏙 Недалеко от Арбата; 🎓 Удобно добираться до большинства вузов,55000,60000
3,Горный Гигант (выше проспекта Аль-Фараби),"смешанный (парни и девушки, отдельные комнаты)",активен,да,да,да,,Тихое и комфортное место в районе Горный Гигант. Главное преимущество — практически в каждой комнате собственный санузел.,🚿 Почти в каждой комнате собственный санузел; 🌿 Тихий и спокойный район; 🎓 Удобное расположение относительно вузов,55000,70000
4,Нур-Алатау,"смешанный (парни и девушки, отдельные комнаты)",активен,да,да,да,,"Экологически чистый район со свежим воздухом, недалеко от парка Первого Президента. Тихая атмосфера, удобно добираться до вузов и других районов города.",🌿 Экологически чистый район; 🌳 Рядом парк Первого Президента; 🌞 Тихая атмосфера,45000,65000
5,рядом с Dostyk Plaza,"смешанный (парни и девушки, отдельные комнаты)",активен,да,да,да,,"Светлый, просторный и уютный дом рядом с Dostyk Plaza. Большой двор и просторный балкон для отдыха. Удобная локация.",📍 Рядом с Dostyk Plaza; 🌳 Большой двор; ☀️ Светлые и просторные комнаты; 🌿 Просторный балкон,65000,70000
6,,—,на ремонте,,,,,"Дом сейчас на ремонте и недоступен для заселения. Не предлагай его студентам. Если спрашивают — скажи, что дом временно закрыт, и предложи другой дом со свободными местами.",,,
